{
  "schema_version": "1.0.0",
  "verification_id": "33333333-3333-4333-8333-333333333333",
  "task_id": "yurikuchumov-ux/ai-operating-system#18",
  "execution_id": "11111111-1111-4111-8111-111111111111",
  "subject_sha": "bbbbbbbbbbbbbbbbbbbbbbbbbbbbbbbbbbbbbbbb",
  "verifier_identity": {
    "operator_principal": "service:offline-fixture",
    "agent_runtime_id": "deterministic:fixture-validator:1.0.0",
    "credential_principal": "none:offline",
    "delegation_parent": "fixture:verification-valid",
    "role": "verifier"
  },
  "passed": true,
  "predicate_results": [
    {
      "predicate_id": "schema.instance.valid",
      "passed": true,
      "observed": {"valid": true},
      "evidence_artifact_ids": ["verification-report"],
      "failure_code": null
    }
  ],
  "evidence": [
    {
      "id": "verification-report",
      "type": "fixture-report",
      "uri": "artifacts/verification.json",
      "sha256": "ffffffffffffffffffffffffffffffffffffffffffffffffffffffffffffffff"
    }
  ],
  "evaluated_at": "2026-07-13T10:06:00Z"
}
